{
  "slug": "computer-science-fundamentals",
  "title": "Computer Science fundamentals",
  "prerequisites": [],
  "learning_objectives": [
    "Identify the fundamental components of a computer system (hardware, software, operating system)",
    "Differentiate hardware, system software, and application software",
    "Understand major ways to run Python code and when to use each approach"
  ],
  "core_explanation": "Computer Science fundamentals lay the groundwork for understanding how computers work and how to interact with them effectively, even before writing complex code. It involves grasping the distinction between **hardware** (the physical components like CPU, memory, and storage that execute instructions), **system software** (like operating systems, which manage hardware resources and provide a platform for other software), and **application software** (programs designed for specific user tasks, such as web browsers or word processors). Understanding file systems, permissions, and the command line is crucial for navigating your computer and managing files. For Python, you'll learn about different ways to run code: using the interactive interpreter (great for quick tests), running scripts from the command line (ideal for executing saved programs), or integrated development environments (IDEs) like VS Code (which offer comprehensive tools for coding, debugging, and project management, streamlining the software development process). This foundational knowledge ensures a smoother journey into programming.",
  "worked_examples": [
    "**Navigating the Command Line:** Open your terminal (macOS/Linux) or Command Prompt/PowerShell (Windows). To see your current location, type `pwd` (macOS/Linux), `Get-Location` or `gl` (PowerShell), or `cd` without arguments (Windows Command Prompt). To change directories, use `cd <folder_name>`, e.g., `cd Documents` to move into the Documents folder. This helps you understand your computer's file structure, which is essential for managing your projects.",
    "**Running a Simple Python Script:** Create a file named `hello.py` with `print('Hello, CS Fundamentals!')`. Save it. Open your terminal, navigate to the file's directory, and run `python hello.py`. This executes your first Python program, a common way to run larger applications.",
    "**Interactive Python Interpreter:** Open your terminal and type `python`. You'll see `>>>`. Type `2 + 2` and press Enter. The interpreter immediately shows `4`. This is great for testing small snippets of code, exploring Python features interactively, or debugging specific lines.",
    "**Using an IDE (VS Code):** Install VS Code. Open it, create a new file, save it as `my_script.py`, and write some Python code. VS Code provides features like syntax highlighting, auto-completion, a debugger, and a built-in terminal to run your script directly, streamlining development and project management."
  ],
  "common_pitfalls": [
    "Incorrect file paths when running scripts from the command line.",
    "Forgetting to save changes before running a Python file.",
    "Not having Python installed or configured correctly in the system's PATH.",
    "Confusing syntax errors (caught during parsing) with runtime errors (caught during execution)."
  ],
  "practice_tasks": [
    "Explore your computer's file system using command line commands.",
    "Create a Python file that prints your name and run it.",
    "Use the interactive Python interpreter to perform basic math.",
    "Install VS Code and run a simple Python script within its terminal."
  ],
  "tags": [
    "python",
    "foundations",
    "computer-science",
    "setup"
  ],
  "difficulty": 1,
  "estimated_time_minutes": 180
}