{
  "slug": "introduction-to-base-python-part-1",
  "title": "Introduction to Python: Basic Operations and Built-in Data Types",
  "prerequisites": [
    "computer-science-fundamentals"
  ],
  "learning_objectives": [
    "Write simple Python programs with arithmetic, console output, and user input",
    "Identify and use common built-in data types (numbers, booleans, strings) to store simple data"
  ],
  "core_explanation": "Python is a versatile and beginner-friendly language. This unit introduces fundamental concepts: performing calculations using arithmetic operators (+, -, *, /, //, %, **), displaying information to the console with `print()`, and getting input from users with `input()`. You'll learn about essential built-in data types: numbers (integers for whole numbers, floats for decimals), booleans (True/False for logical states), and strings (sequences of characters for text). Understanding these basic building blocks is crucial for writing any Python program.",
  "worked_examples": [
    "x = 10\ny = 3\nprint(f\"Sum: {x + y}\")\nprint(f\"Quotient: {x / y}\")\nprint(f\"Remainder: {x % y}\")\nThis shows basic arithmetic operations and formatted output using an f-string.",
    "name = input(\"Enter your name: \")\nage_str = input(\"Enter your age: \")\nage = int(age_str)\nprint(f\"Hello, {name}! You are {age} years old.\")\nThis example demonstrates taking string input, converting it to an integer for calculations, and using it in an f-string.",
    "is_active = True\ncan_proceed = False\nprint(f\"Active status: {is_active}\")\nprint(f\"Can proceed? {can_proceed}\")\n# Booleans are often results of comparisons\nage = 25\nis_adult = age >= 18\nprint(f\"Is adult? {is_adult}\")\nThis example demonstrates assigning and printing boolean values, and how a comparison operation yields a boolean."
  ],
  "common_pitfalls": [
    "Forgetting to convert `input()` (which always returns strings) to numbers before performing arithmetic operations, leading to type errors or unexpected string concatenation.",
    "Confusing integer division (`//`) with float division (`/`), especially when expecting decimal results."
  ],
  "practice_tasks": [
    "Write a program to calculate the area of a rectangle from user-provided length and width. Print the result.",
    "Experiment with different arithmetic operators (e.g., `**` for exponentiation) and observe their results with various number types (integers, floats).",
    "Create a program that asks for your favorite color and a number. Print a sentence combining this information, e.g., 'My favorite color is [color] and my lucky number is [number].'"
  ],
  "tags": [
    "python",
    "basics",
    "data-types",
    "operators",
    "io",
    "numbers",
    "strings",
    "booleans"
  ],
  "difficulty": 1,
  "estimated_time_minutes": 25
}