{
  "slug": "introduction-to-data-visualization-in-matplotlib-and-seaborn",
  "title": "Introduction to Data Visualization in Matplotlib and Seaborn",
  "prerequisites": [
    "introduction-to-numpy-and-pandas"
  ],
  "learning_objectives": [
    "Understand the pyplot plotting workflow and its relation to MATLAB-style usage",
    "Use Matplotlib for plot structure, geometry control, and basic charting",
    "Use Seaborn on top of Matplotlib/Pandas for quick statistical visualizations"
  ],
  "core_explanation": "Data visualization is crucial for understanding datasets. Matplotlib is Python's foundational plotting library, offering fine-grained control over plot elements like figures, axes, and basic chart types (line, scatter, bar). Its `pyplot` module provides a MATLAB-like interface for quick plotting. Seaborn builds on Matplotlib, providing a high-level interface for drawing attractive and informative statistical graphics. It integrates seamlessly with Pandas DataFrames, simplifying complex visualizations like distributions, relationships, and categorical plots. Together, they form a powerful toolkit for exploring and presenting data.",
  "worked_examples": [
    "Create a simple line plot using Matplotlib's `pyplot` module. This demonstrates the fundamental workflow of defining data points and plotting them.\n\nimport matplotlib.pyplot as plt\n\nx = [1, 2, 3, 4]\ny = [10, 15, 13, 18]\nplt.plot(x, y)\nplt.title('Simple Line Plot')\nplt.xlabel('X-axis')\nplt.ylabel('Y-axis')\nplt.show()",
    "Generate a scatter plot to visualize the relationship between two variables. Add axis labels and a title for clarity, showcasing basic plot customization.\n\nimport matplotlib.pyplot as plt\n\nx = [1, 2, 3, 4]\ny = [18, 13, 15, 10]\nplt.scatter(x, y)\nplt.title('Simple Scatter Plot')\nplt.xlabel('Feature A')\nplt.ylabel('Feature B')\nplt.show()",
    "Demonstrate Matplotlib's object-oriented approach to create subplots and control figure geometry, such as figure size and axis limits.\n\nimport matplotlib.pyplot as plt\nimport numpy as np\n\n# Create a figure and a set of subplots (1 row, 2 columns)\nfig, axes = plt.subplots(1, 2, figsize=(10, 4))\n\n# Plot on the first subplot\nx = np.linspace(0, 10, 100)\naxes[0].plot(x, np.sin(x), color='blue')\naxes[0].set_title('Sine Wave')\naxes[0].set_xlabel('X-axis')\naxes[0].set_ylabel('Y-axis')\naxes[0].set_xlim(0, 10) # Set x-axis limits\n\n# Plot on the second subplot\naxes[1].plot(x, np.cos(x), color='red')\naxes[1].set_title('Cosine Wave')\naxes[1].set_xlabel('X-axis')\naxes[1].set_ylabel('Y-axis')\naxes[1].set_ylim(-1.5, 1.5) # Set y-axis limits\n\nplt.tight_layout() # Adjust subplot parameters for a tight layout\nplt.show()",
    "Use Seaborn to quickly visualize the distribution of a single numerical variable with a histogram. Seaborn handles binning and styling automatically, making it easy to create informative histograms.\n\nimport seaborn as sns\nimport matplotlib.pyplot as plt\nimport numpy as np\n\ndata = np.random.normal(loc=0, scale=1, size=100)\nsns.histplot(data, kde=True)\nplt.title('Distribution of Random Data')\nplt.show()",
    "Plot a scatter plot directly from a Pandas DataFrame using Seaborn. This highlights Seaborn's integration with DataFrames, simplifying data selection and plotting.\n\nimport pandas as pd\nimport seaborn as sns\nimport matplotlib.pyplot as plt\n\ndf = pd.DataFrame({\n    'size': [10, 15, 20, 25, 30],\n    'price': [100, 150, 180, 220, 250]\n})\nsns.scatterplot(x='size', y='price', data=df)\nplt.title('Price vs. Size')\nplt.show()"
  ],
  "common_pitfalls": [
    "Forgetting `plt.show()`: Plots won't display without this call in some environments, especially scripts.",
    "Overlapping plots: Not creating new figures or axes for distinct plots can lead to messy, unreadable visuals. Always use `plt.figure()` or the object-oriented `fig, ax = plt.subplots()` for each new plot to ensure proper separation.",
    "Incorrect data format: Seaborn often expects data in a Pandas DataFrame for easy column referencing by name."
  ],
  "practice_tasks": [
    "Create a Matplotlib bar chart showing sales for different product categories.",
    "Generate a Seaborn box plot to compare the distribution of a variable across groups.",
    "Add a legend and customize colors on a Matplotlib line plot with two lines."
  ],
  "tags": [
    "python",
    "matplotlib",
    "seaborn",
    "visualization"
  ],
  "difficulty": 2,
  "estimated_time_minutes": 60
}