{
  "slug": "introduction-to-base-python-part-2",
  "title": "Introduction to base python (part-2)",
  "prerequisites": [
    "introduction-to-base-python-part-1"
  ],
  "learning_objectives": [
    "Translate simple problem ideas into pseudocode and executable Python steps",
    "Apply conditionals, loops, and functions to structure program flow",
    "Handle basic file input and output reliably"
  ],
  "core_explanation": "Building on Python fundamentals, this module introduces algorithmic thinking, guiding you to translate problem ideas into logical pseudocode and then into executable Python steps. You'll master controlling program flow using conditional statements (`if/else`) for decision-making and both `for` and `while` loops for efficient repetition. We'll then explore functions to organize code into reusable blocks, understanding how to define them, pass arguments, and return values. Finally, you'll gain practical skills in handling basic file input and output, enabling your programs to interact with external files for reading and writing data. This comprehensive knowledge is crucial for writing structured, efficient, and robust Python applications.",
  "worked_examples": [
    "Determine if a number is even or odd using an `if/else` statement. This demonstrates basic decision-making logic.\n`num = 10\nif num % 2 == 0:\n    print('Even')\nelse:\n    print('Odd')`",
    "Use a `for` loop to iterate and sum numbers from 1 to 5. `for` loops are essential for iterating over sequences.\n`total = 0\nfor i in range(1, 6):\n    total += i\nprint(total)`",
    "Use a `while` loop to count down from 5 to 1. `while` loops are useful for repetition based on a condition.\n`count = 5\nwhile count > 0:\n    print(count)\n    count -= 1\nprint('Blast off!')`",
    "Define a function `greet` that takes a name and returns a greeting. Functions encapsulate reusable code.\n`def greet(name):\n    return f'Hello, {name}!'\nprint(greet('Alice'))`",
    "Write text to 'my_file.txt' and then read its content back. File I/O allows programs to interact with the file system.\n`with open('my_file.txt', 'w') as f:\n    f.write('Hello, File!')\nwith open('my_file.txt', 'r') as f:\n    content = f.read()\nprint(content)`"
  ],
  "common_pitfalls": [
    "Incorrect indentation in Python leads to `IndentationError`.",
    "Forgetting `return` in functions; functions without `return` implicitly return `None`.",
    "Not closing files or using `with` statement, risking data loss or resource leaks.",
    "Infinite loops due to incorrect loop conditions or missing increment/decrement."
  ],
  "practice_tasks": [
    "Write a program that checks if a given year is a leap year.",
    "Create a function that calculates the factorial of a number.",
    "Use a loop to print the first 10 numbers of the Fibonacci sequence.",
    "Write a program to count lines in a text file."
  ],
  "tags": [
    "python",
    "control-flow",
    "functions",
    "file-io",
    "algorithms"
  ],
  "difficulty": 2,
  "estimated_time_minutes": 150
}