{
  "slug": "introduction-to-base-python-part-1",
  "title": "Introduction to base python (part-1)",
  "prerequisites": [
    "computer-science-fundamentals"
  ],
  "learning_objectives": [
    "Write simple Python programs with arithmetic, console output, and user input",
    "Recognize built-in data types and select suitable structures for small tasks",
    "Understand foundational data structure concepts such as methods and attributes"
  ],
  "core_explanation": "Python is a versatile language, great for beginners. This unit covers fundamental concepts: performing calculations using arithmetic operators (+, -, *, /, //, %, **), displaying information to the console with `print()`, and getting input from users with `input()`. You'll learn about essential built-in data types like numbers (integers, floats), booleans (True/False), and strings (text). We'll also explore basic data structures: lists (ordered, mutable collections), tuples (ordered, immutable), sets (unordered, unique items), and dictionaries (key-value pairs). Understanding methods (functions associated with an object) and attributes (data associated with an object) is key to interacting with these structures effectively.",
  "worked_examples": [
    "x = 10\ny = 3\nprint(f\"Sum: {x + y}\")\nprint(f\"Quotient: {x / y}\")\nprint(f\"Remainder: {x % y}\")\nThis shows basic arithmetic and formatted output using an f-string.",
    "name = input(\"Enter your name: \")\nage_str = input(\"Enter your age: \")\nage = int(age_str)\nprint(f\"Hello, {name}! You are {age} years old.\")\nThis example demonstrates taking string input and converting it to an integer for calculations or further use.",
    "my_list = [1, 2, 3]\nmy_list.append(4)\nprint(my_list)\nprint(len(my_list))\nThis illustrates adding an item to a list using the `append()` method and getting its length using the `len()` function (an attribute-like property).",
    "student = {\"name\": \"Alice\", \"age\": 20}\nprint(student[\"name\"].upper())\nprint(student.keys())\nThis shows accessing a dictionary value and applying a string method (`upper()`), plus using a dictionary method (`keys()`)."
  ],
  "common_pitfalls": [
    "Forgetting to convert `input()` (which returns strings) to numbers before arithmetic operations.",
    "Trying to access list or tuple elements using an index that is out of bounds.",
    "Not understanding that lists are mutable (changeable) while tuples and strings are immutable.",
    "Accessing a dictionary with a key that does not exist, leading to a `KeyError`."
  ],
  "practice_tasks": [
    "Write a program to calculate the area of a rectangle from user-provided length and width.",
    "Create a list of your favorite fruits. Add a new fruit, then print the list and its size.",
    "Make a dictionary for a book with title, author, and year. Print the title in uppercase.",
    "Experiment with different arithmetic operators and observe their results."
  ],
  "tags": [
    "python",
    "basics",
    "data-types",
    "data-structures"
  ],
  "difficulty": 1,
  "estimated_time_minutes": 25
}